name,address,country,phone,website,google_maps_url,resumen,colores_hex,url_logo,url_screenshot
Qaroní (A Coruña),"Rúa Emilio González López, 51, bajo, 15011 A Coruña, Spain",Spain,881 02 59 24,https://qaroni.com/,https://maps.google.com/?cid=3303373921451861088,"Qaroní es una empresa especializada en el desarrollo de software a medida, ofreciendo soluciones innovadoras para diversos sectores como banca, administración pública, logística, tercer sector, industria, retail y e-commerce. Su enfoque se centra en hacer que la tecnología trabaje para sus clientes, creando software seguro, escalable y centrado en la experiencia del usuario. Además, ofrecen servicios de consultoría estratégica, diseño UX/UI, innovación y data science.

Entre los productos principales de Qaroní se encuentran Workards, un software de recursos humanos; PLAAM, un software ERP & CRM multisector; Rutas de Tapeo, una plataforma para concursos gastronómicos de tapas; Localbono, una solución de bonos QR; QPay360, una solución cashless; Fideliza, programas de lealtad; y Genova, una solución de inteligencia artificial generativa. Estos productos están diseñados para ayudar a las empresas a digitalizar procesos, mejorar la experiencia del cliente y optimizar recursos.

El público objetivo de Qaroní son empresas de diversos sectores que buscan soluciones tecnológicas innovadoras y personalizadas para mejorar su eficiencia y competitividad en el mercado. Las ventajas competitivas de la empresa radican en su enfoque en la experiencia del usuario, la seguridad de sus soluciones, su","['#568189', '#f8f9fc', '#f9b557', '#b9bec0', '#0d2c3e']",https://business-finder-assets-2024.s3.amazonaws.com/logos/qaroni-logo-black.webp,https://business-finder-assets-2024.s3.amazonaws.com/screenshots/qaroni.com_.png
Docuten Tech,"HI Coruña, Av. Porto da Coruña, 3, Planta Baja. Local 6, 15003 A Coruña, La Coruña, Spain",Spain,981 26 96 85,http://www.docuten.com/,https://maps.google.com/?cid=6618645764236301975,"Docuten es una empresa especializada en la digitalización de procesos administrativos, ofreciendo servicios de firma digital y facturación electrónica. Su propuesta de valor se centra en agilizar la gestión de documentación laboral, mercantil y comercial, eliminando el papel y simplificando tareas innecesarias. Con reconocimiento como Prestador Cualificado de Servicios de Confianza, garantizan la legalidad y seguridad en todas las transacciones.

Los principales servicios de Docuten incluyen la firma digital, la emisión y recepción de facturas electrónicas, la digitalización de la documentación de transporte, y la automatización de procesos administrativos en el sector alimentario. Su público objetivo abarca empresas de diversos sectores que buscan optimizar sus operaciones a través de la digitalización. Con más de 100 clientes en el sector alimentario y testimonios positivos de su eficacia, Docuten se posiciona como un aliado confiable para la gestión documental.

Las ventajas competitivas de Docuten radican en su certificación como Prestador Cualificado de Servicios de Confianza, su adaptación a normativas legales como la Ley Crea y Crece y el Reglamento VeriFactu, y su enfoque en la personalización y atención al cliente. Con una plataforma intuitiva y accesible desde cualquier dispositivo, Doc","['#2c76f6', '#fafafb', '#2f5dec', '#9fb8e1', '#494a4b']",https://business-finder-assets-2024.s3.amazonaws.com/logos/logo_positivo.svg,https://business-finder-assets-2024.s3.amazonaws.com/screenshots/www.docuten.com_.png
Plexus Tech (A Coruña),"Rúa Galileo Galilei, nº 2- 1º, 15008 A Coruña, Spain",Spain,902 99 80 05,https://www.plexus.es/,https://maps.google.com/?cid=13708329479081154242,"Plexus Tech es una empresa de consultoría, servicios y soluciones en tecnologías de la información. Con una amplia trayectoria en el mercado, ofrecen servicios tecnológicos y soluciones integrales desarrolladas a medida para organismos públicos, compañías del IBEX 35, grandes retailers, operadores turísticos y entidades financieras. Además, cuentan con productos propios innovadores centrados en mejorar la vida de personas y compañías.

Entre los servicios principales de Plexus Tech se encuentran el desarrollo de soluciones tecnológicas a medida, un ecosistema de servicios tecnológicos 360º basados en innovación y desarrollo, y la creación de productos propios para diversos sectores. Su público objetivo son organismos públicos, grandes empresas del IBEX 35, retailers, operadores turísticos y entidades financieras que buscan soluciones tecnológicas personalizadas y de vanguardia. Plexus Tech se destaca por su liderazgo en el desarrollo de productos innovadores y su enfoque en la mejora constante de la experiencia de sus clientes.

Las ventajas competitivas de Plexus Tech radican en su amplia experiencia en el mercado, su enfoque en la innovación y desarrollo de soluciones tecnológicas a medida, así como en la calidad de sus productos propios. Además, su equipo de profesionales altamente capacitados y","['#fefefe', '#537c8d', '#d2dadd', '#063e57', '#9eb5be']",https://business-finder-assets-2024.s3.amazonaws.com/logos/LOGO-PLEXUS-2020_WHITE.png,https://business-finder-assets-2024.s3.amazonaws.com/screenshots/www.plexus.es_.png
