name,address,country,phone,website,google_maps_url,resumen,colores_hex,url_logo,url_screenshot
"NutriSalud- Centro Multidisciplinar de nutrición, psiquiatria y psicología.","Rúa do Paraguai, 1, Santiago de Vigo, 36204 Vigo, Pontevedra, Spain",Spain,986 11 81 39,http://nutrisalud.es/,https://maps.google.com/?cid=7789232752776135715,"Nutrisalud es una clínica de nutrición multidisciplinar en Vigo, especializada en tratamientos nutricionales graves como trastornos de la conducta alimentaria, anorexia, bulimia y otros desórdenes alimentarios. Cuentan con unidades especializadas en patologías digestivas, obesidad y asesoramiento externo para empresas, charlas y conferencias. Su equipo está formado por psiquiatras, psicólogos clínicos, nutricionistas y entrenadores personales.

El público objetivo de Nutrisalud son pacientes con trastornos alimentarios, problemas de obesidad, patologías digestivas y empresas que buscan asesoramiento nutricional. Sus ventajas competitivas radican en su enfoque multidisciplinar, con un equipo especializado en diferentes áreas de la salud, y en su atención personalizada y continua a los pacientes y sus familias. Además, ofrecen la posibilidad de seguimiento online para aquellos pacientes que no pueden acudir presencialmente a la clínica.

En Nutrisalud, el enfoque principal es la atención al paciente y a sus familias de forma diaria y continua, promoviendo una alimentación consciente y un espacio de acompañamiento durante todo el proceso de tratamiento. Su compromiso con la salud y el bienestar de los pacientes se","['#3a3e4c', '#292e38', '#424755', '#79616e', '#313642']",https://business-finder-assets-2024.s3.amazonaws.com/logos/logo-nutrisalud.png,https://business-finder-assets-2024.s3.amazonaws.com/screenshots/nutrisalud.es_.png
Clínica adelgazamiento Dra. Sotelo,"Rúa de Urzáiz, 94, Santiago de Vigo, 36204 Vigo, Pontevedra, Spain",Spain,986 42 42 50,,https://maps.google.com/?cid=660295063328372859,,,,
Clinica Dr. Hortas,"Rúa de Urzáiz, 107, Santiago de Vigo, 36204 Vigo, Pontevedra, Spain",Spain,986 48 34 51,,https://maps.google.com/?cid=8947335648726983114,,,,
"Nutrendo, Centro Médico Nutricional Vigo","Rúa San Salvador, 2, Santiago de Vigo, 36204 Vigo, Pontevedra, Spain",Spain,986 41 47 45,http://www.nutrendo.es/,https://maps.google.com/?cid=6676810605022964144,"Nutrendo es un Centro Médico Nutricional en España que se especializa en el tratamiento del sobrepeso y la obesidad. Fundado en 2012 por la Dra. Ferrández, el centro ofrece un enfoque único que combina ciencia, personalización y acompañamiento integral para transformar la salud de sus pacientes.

Entre los servicios principales que ofrece Nutrendo se encuentran la Nutrición Clínica, la Unidad de Obesidad (Endobesidad), Nutrendo Sport, Nutrendo Educa y Nutrendo Empresas. Además, cuentan con programas específicos como el Programa ALLURION, el Programa SMART, Programas Endoscópicos y Programas de Cirugía Bariátrica.

El público objetivo de Nutrendo son personas que buscan perder peso de forma saludable y sostenible en el tiempo, bajo estricta supervisión médica. Las ventajas competitivas de Nutrendo radican en su método de cambio de hábitos personalizado, el seguimiento constante por parte de un equipo multidisciplinario y el enfoque integral que abarca aspectos físicos, nutricionales y emocionales para garantizar el éxito en la consecución de los objetivos de sus pacientes.","['#bcc0be', '#ecebe8', '#2d2522', '#728782', '#fcfcfc']",https://business-finder-assets-2024.s3.amazonaws.com/logos/logo-nutrendo.png,https://business-finder-assets-2024.s3.amazonaws.com/screenshots/www.nutrendo.es_.png
Dieta Coherente,"Rúa Caracas, 4, Bajo, Santiago de Vigo, 36203 Vigo, Pontevedra, Spain",Spain,986 11 45 17,http://www.dietacoherente.com/,https://maps.google.com/?cid=16236748977615829207,"Dieta Coherente es un negocio que ofrece servicios de nutricionista online, con el objetivo de promover hábitos alimentarios saludables y proporcionar información rigurosa sobre alimentación y nutrición de forma sencilla y cercana. Con más de 20 años de experiencia, cuentan con un equipo de nutricionistas que diseñan dietas personalizadas para ayudar a perder peso de manera rápida y equilibrada, validadas por la ISO 9001 y universidades reconocidas.

Los servicios principales que ofrece Dieta Coherente son las consultas online, planes mensuales, menús online y libros relacionados con la nutrición y la salud. Su público objetivo son personas que buscan perder peso de forma saludable, mejorar su alimentación, deportistas, embarazadas, personas con patologías específicas, vegetarianos, veganos, entre otros. Además, ofrecen seguimiento durante todo el proceso con trucos de coaching y motivación.

Las ventajas competitivas de Dieta Coherente radican en su experiencia de más de 20 años en el sector, la personalización de las dietas según las necesidades de cada cliente, la validación de sus servicios por entidades reconocidas, como la ISO 9001 y universidades, y la satisfacción de más de 100,000 clientes satisfechos que han logrado mejorar su salud con la ayuda","['#f7f8f7', '#97ba55', '#7f7f74', '#46402d', '#c5c5b1']",https://business-finder-assets-2024.s3.amazonaws.com/logos/logo-dietacoherente.png,https://business-finder-assets-2024.s3.amazonaws.com/screenshots/www.dietacoherente.com_.png
Nutricionista en Vigo. Natalia Albino,"Rúa do Paraguai, 1, Santiago de Vigo, 36204 Vigo, Pontevedra, Spain",Spain,986 11 81 39,,https://maps.google.com/?cid=4493798727292586351,,,,
Lucia Terzi Nutricionista,"Rúa de Barcelona, 83, bajo, Freijeiro, 36211 Vigo, Pontevedra, Spain",Spain,659 03 58 29,https://luciaterzi.com/,https://maps.google.com/?cid=965108882868382288,"Lucía Terzi es una nutricionista clínica especializada en psiconutrición que ofrece planes personalizados para alcanzar el peso deseado y mejorar el bienestar físico y mental de sus pacientes. Su enfoque se basa en escuchar atentamente a cada persona, adaptando sus intervenciones de dietoterapia a las necesidades fisiopatológicas y circunstancias vitales de cada uno. 

Los servicios principales que ofrece Lucía Terzi incluyen consultas individuales tanto online como presenciales, programas grupales online y un programa premium online. Además, se especializa en nutrición en digestivo, obesidad y sobrepeso, intolerancias y alergias, enfermedades autoinmunes, migraña, fatiga y déficit de DAO. 

El público objetivo de Lucía Terzi son personas que buscan alcanzar un peso saludable, mejorar su relación con la comida y trabajar en su bienestar físico y mental. Sus ventajas competitivas radican en su enfoque personalizado, su especialización en psiconutrición y su experiencia en el campo de la nutrición clínica. Además, su atención empática y su enfoque educativo hacia la nutrición la destacan como una profesional altamente recomendada por sus pacientes.","['#fefefe', '#e6ece1', '#c8c6b7', '#f1f3ef', '#9f9474']",https://business-finder-assets-2024.s3.amazonaws.com/logos/cropped-Logo-Iniciales-de-nombre-personal-minimalista-profesional-negro-150x105.png,https://business-finder-assets-2024.s3.amazonaws.com/screenshots/luciaterzi.com_.png
CharroSalud Registro Saniatrio C-36-003449,"Rúa Cristo, 4, bajo, Lavadores, 36205 Vigo, Pontevedra, Spain",Spain,986 11 00 03,http://www.manuelportela.es/,https://maps.google.com/?cid=16766949458286288826,"El negocio en cuestión es una empresa dedicada a la fabricación y venta de muebles de diseño exclusivo y alta calidad. Su principal enfoque es ofrecer mobiliario moderno y elegante para hogares y oficinas, con un énfasis en la funcionalidad y el diseño innovador. La empresa se destaca por trabajar con materiales de primera calidad y por contar con un equipo de diseñadores creativos que crean piezas únicas y personalizadas para sus clientes.

Entre los servicios y productos principales que ofrece la empresa se encuentran la fabricación de sofás, mesas, sillas, armarios, estanterías y otros muebles de diseño contemporáneo. Además, la empresa también ofrece servicios de diseño de interiores y asesoramiento personalizado para ayudar a sus clientes a crear espacios únicos y acogedores. Se destacan por su atención al detalle, la alta calidad de sus productos y la capacidad de adaptarse a las necesidades y gustos de cada cliente.

El público objetivo de la empresa son personas que valoran el diseño y la calidad en los muebles de su hogar u oficina, y que buscan piezas exclusivas y personalizadas. Su clientela suele ser personas con un poder adquisitivo medio-alto, interesadas en invertir en mobiliario de alta gama y que buscan dar un toque único y sofistic","['#d6d3cd', '#fdfdfd', '#a8a39b', '#72593d', '#df9c57']",,https://business-finder-assets-2024.s3.amazonaws.com/screenshots/www.manuelportela.es_.png
Rocío Portal - Centro Nutrición y Psicología en Vigo,"Rúa de Urzáiz, 31, 3º A, Santiago de Vigo, 36201 Vigo, Pontevedra, Spain",Spain,663 77 85 58,http://www.rocioportalnutricion.com/,https://maps.google.com/?cid=80712093813369035,"El Centro de Nutrición y Psicología en Vigo ofrece servicios especializados en trastornos alimentarios, dietoterapia en patologías, educación alimentaria, psiconutrición y psicología sanitaria. Su objetivo principal es acompañar a las personas a mejorar su salud integral, promoviendo una alimentación sin normas ni obsesiones y una relación saludable con la comida y el cuerpo. Se dirige a personas que buscan una alternativa a las dietas tradicionales y desean conectar con sus sensaciones de hambre y saciedad.

El público objetivo de este centro son personas que buscan una alimentación más amable y respetuosa con su cuerpo, que desean disfrutar de la comida sin prohibiciones y mejorar su relación con la alimentación. Las ventajas competitivas de este negocio radican en su enfoque de salud en todas las tallas, su abordaje integral que incluye tanto nutrición como psicología, y la personalización de los tratamientos para cada cliente. Además, cuentan con un equipo interdisciplinar de nutricionistas y psicólogas que trabajan de manera coordinada para ofrecer un tratamiento completo y efectivo.

En resumen, el Centro de Nutrición y Psicología en Vigo se destaca por su enfoque integral y personalizado en el tratamiento de trastornos alimentarios y","['#eae7d7', '#4b706b', '#fefefe', '#b5a286', '#513922']",https://business-finder-assets-2024.s3.amazonaws.com/logos/cropped-Rocio-Portal-Logomarca-principal-v1-125x71.png,https://business-finder-assets-2024.s3.amazonaws.com/screenshots/www.rocioportalnutricion.com_.png
Nutrición Beatriz Dosdá. Dietista-Nutricionista Consultas PRESENCIALES Y ONLINE.,"C/ Barcelona, 78 Interior, FISIOTERAPIA PEJITO, Freijeiro, 36203 Vigo, Pontevedra, Spain",Spain,660 17 27 51,https://concienciacomo.com/,https://maps.google.com/?cid=4148940343616361172,"Beatriz Dosdá es una Dietista-Nutricionista y Tecnóloga de los Alimentos que ofrece servicios de nutrición personalizada, consultoría y asesoría nutricional, así como cursos y talleres relacionados con la alimentación saludable. Su enfoque se centra en promover una buena relación con la comida, sin obsesiones ni ansiedad, y sin culpas asociadas a la alimentación. 

Su público objetivo son personas interesadas en mejorar su alimentación, ya sea para alcanzar objetivos de salud específicos, aprender más sobre nutrición o simplemente adoptar hábitos alimenticios más saludables. Beatriz Dosdá se dirige tanto a individuos que buscan una atención personalizada en nutrición como a empresas del sector de la restauración colectiva que desean implementar menús saludables.

Las ventajas competitivas de Beatriz Dosdá radican en su formación como Tecnóloga de los Alimentos, lo que le permite ofrecer un enfoque integral en sus servicios nutricionales. Además, su enfoque en promover una relación saludable con la comida y su compromiso con la alimentación saludable como un aspecto divertido y libre de culpas, la destacan en un mercado saturado de consejos nutricionales restrictivos y poco realistas. Su variedad de servicios, que van desde la","['#6d7676', '#fbfbfa', '#332d28', '#bc7a4b', '#c4c4bd']",,https://business-finder-assets-2024.s3.amazonaws.com/screenshots/concienciacomo.com_.png
Sernuga - 100% Saludable,"Centro DAX, Rúa Zamora, 48, bajo, Freixeiro, 36203 Vigo, Pontevedra, Spain",Spain,986 16 06 75,http://www.cienporciensaludable.com/,https://maps.google.com/?cid=11527468002963033061,"Sernuga es una empresa que ofrece servicios de dietética y nutrición 100% saludables, con programas personalizados para particulares, empresas y colectividades. Sus servicios principales incluyen programas de adelgazamiento, consultoría nutricional, tratamiento de trastornos de la alimentación, educación nutricional, y programas de acompañamiento para mujeres embarazadas o en período de lactancia. Su público objetivo abarca desde personas individuales que buscan mejorar su salud hasta empresas que desean promover hábitos de vida saludables entre sus empleados.

Las ventajas competitivas de Sernuga radican en su enfoque personalizado y adaptado a las necesidades de cada cliente, así como en su amplia gama de servicios que abarcan desde la prevención de enfermedades hasta el tratamiento de trastornos alimentarios. Además, la empresa cuenta con un equipo de profesionales altamente cualificados y con experiencia en el campo de la nutrición y la dietética, lo que garantiza un servicio de calidad y confianza para sus clientes. Por último, Sernuga se destaca por su compromiso con la ética y la deontología profesional, demostrado a través de su código deontológico y su enfoque en promover hábitos de vida saludables de manera responsable y sostenible.","['#a3a3a3', '#f9f9fb', '#646e38', '#7d8880', '#c7cbcf']",,https://business-finder-assets-2024.s3.amazonaws.com/screenshots/www.cienporciensaludable.com_.png
Santi Groba Nutrición,"R. de Rosalía de Castro, 28, oficinas/oficina 3-puerta izquierda, Santiago de Vigo, 36201 Vigo, Pontevedra, Spain",Spain,670 34 45 59,http://santigrobanutricion.com/,https://maps.google.com/?cid=15617295475381192284,"Santi Groba Nutrición es un negocio que se dedica a ofrecer servicios de nutrición clínica, deportiva, estética y pediátrica, así como educación nutricional, programas de entrenamiento, complementos alimenticios, charlas y talleres. El objetivo principal es ayudar a las personas a aprender a comer de manera saludable, tanto a través de consultas presenciales como online. El fundador, Santi Groba, es Dietista-Nutricionista y Biólogo sanitario con 13 años de experiencia en el campo.

Los servicios principales que ofrece Santi Groba Nutrición incluyen consultas personalizadas, educación nutricional, programas de entrenamiento adaptados, asesoramiento en la lista de la compra, y la elaboración de planes nutricionales adaptados a cada situación individual. El público objetivo de este negocio son personas que buscan mejorar su salud a través de una alimentación adecuada, ya sea para tratar enfermedades no transmisibles, optimizar su rendimiento deportivo, mejorar su estética corporal o recibir educación nutricional.

Las ventajas competitivas de Santi Groba Nutrición radican en la personalización de los planes nutricionales, la amplia variedad de servicios ofrecidos, la experiencia y profesionalismo del fundador, así como en la posibilidad de recibir asesoramiento tanto de forma","['#101013', '#f8f8f8', '#4b4b4b', '#a9b0a3', '#1f2021']",https://business-finder-assets-2024.s3.amazonaws.com/logos/vertical-transparente-2024-05-22.svg,https://business-finder-assets-2024.s3.amazonaws.com/screenshots/santigrobanutricion.com_.png
Khalos,"R. de Nicaragua, 15, Santiago de Vigo, 36203 Vigo, Pontevedra, Spain",Spain,986 17 40 32,http://khalos.com/,https://maps.google.com/?cid=603650197408793337,"Khalos es un centro de entrenamiento personalizado en Vigo que ofrece servicios integrales de nutrición, deporte y estética para mejorar el estado físico-estético de sus clientes en un plazo razonable. Utilizan la última tecnología en análisis de composición corporal y ofrecen asesoramiento dietético con resultados demostrados. El método de entrenamiento principal es el HIIT, y cuentan con un protocolo propio para ayudar a los clientes a alcanzar sus objetivos.

El público objetivo de Khalos son personas que desean mejorar su estado físico y estético de manera personalizada y efectiva. Aquellos que buscan reducir peso, tonificar su cuerpo o mejorar su salud en general encontrarán en Khalos un aliado para lograr sus objetivos. El centro se enfoca en brindar un servicio completo que abarca desde la nutrición hasta la estética, adaptándose a las necesidades individuales de cada cliente.

Las ventajas competitivas de Khalos radican en su enfoque integral y personalizado, la utilización de tecnología de vanguardia en análisis de composición corporal y la demostrada efectividad de sus métodos de entrenamiento y nutrición. Además, el centro se destaca por ofrecer un servicio de calidad respaldado por profesionales especializados en el cuidado de la salud y el","['#0d0b07', '#fafafa', '#5f675e', '#37362a', '#90a29e']",https://business-finder-assets-2024.s3.amazonaws.com/logos/logo-khalos.png,https://business-finder-assets-2024.s3.amazonaws.com/screenshots/khalos.com_.png
Dieta con Cabeza - Uxía Rodríguez - Dietista Vigo,"Rúa de Pi y Margall, 29, 36202 Vigo, Pontevedra, Spain",Spain,642 68 87 55,http://www.dietaconcabeza.es/,https://maps.google.com/?cid=13608605215278928432,"Dieta con Cabeza - Uxía Rodríguez es un negocio de dietética y nutrición en Vigo que ofrece servicios personalizados para mejorar los hábitos alimenticios y la salud de sus clientes. Su enfoque se basa en crear menús adaptados para diferentes patologías, asesoramiento dietético, nutrición deportiva, pérdida y aumento de peso, entre otros servicios.

El público objetivo de Dieta con Cabeza - Uxía Rodríguez son personas que buscan mejorar su alimentación, adoptar hábitos saludables y alcanzar un estilo de vida equilibrado. Su enfoque se centra en aquellos que buscan una dieta personalizada, lejos de las dietas para adelgazar pasajeras, y que desean disfrutar de la comida sin restricciones.

Las ventajas competitivas de Dieta con Cabeza - Uxía Rodríguez radican en la atención personalizada y profesional que ofrecen, la creación de dietas adaptadas a las necesidades de cada cliente, y la posibilidad de recibir servicios tanto de forma presencial como online. Además, su enfoque en el bienestar integral y en la reeducación de hábitos alimenticios los diferencia en el mercado de la dietética y nutrición en Vigo.","['#f1ecef', '#8d5c36', '#bd9664', '#4d2136', '#dac8a3']",,https://business-finder-assets-2024.s3.amazonaws.com/screenshots/www.dietaconcabeza.es_.png
Asesoramiento dietético YUV Nutrición,"Rúa de García Barbón, 76, Santiago de Vigo, 36202 Vigo, Pontevedra, Spain",Spain,681 88 38 08,https://yuvnutricion.es/,https://maps.google.com/?cid=14165662482456485056,"YUV .Nutrición es un negocio ubicado en Vigo que ofrece planes de nutrición personalizados para sus clientes. Su principal enfoque es brindar asesoría y apoyo continuo a través de planes a medida diseñados para alcanzar objetivos específicos de salud y rendimiento. Con menús personalizados, consejos prácticos y asesoría continua, buscan motivar y guiar a sus clientes por el camino hacia una vida más saludable.

Los servicios principales de YUV .Nutrición incluyen la elaboración de menús personalizados, consejos prácticos para mejorar el rendimiento diario y asesoría continua a través de consultas iniciales y de seguimiento. Su público objetivo son personas que buscan mejorar su salud y alcanzar objetivos específicos a través de la nutrición, brindándoles un enfoque personalizado y orientación experta para lograr cambios duraderos en su estilo de vida.

Las ventajas competitivas de YUV .Nutrición radican en su atención personalizada, apoyo genuino y enfoque en la educación y empoderamiento de sus clientes. Con testimonios que destacan el trato cercano, el seguimiento real y los resultados obtenidos, la empresa se destaca por su compromiso en ayudar a sus clientes a alcanzar sus metas de salud de manera efectiva y satisfactoria","['#fdfdfd', '#bbbcb8', '#53876d', '#ab9b8c', '#977f64']",https://business-finder-assets-2024.s3.amazonaws.com/logos/logoWEB.png,https://business-finder-assets-2024.s3.amazonaws.com/screenshots/yuvnutricion.es_.png
"Dietista Online en Vigo. Laura de la Iglesia. Nutrición y dietética en ""The invisible Center""","Rúa Velázquez Moreno, 7A, 36201 Vigo, Pontevedra, Spain",Spain,659 85 54 41,,https://maps.google.com/?cid=3232064580024099863,,,,
Progresa Centro Integral de Salud,"Rúa Caracas, 8, bajo, Santiago de Vigo, 36203 Vigo, Pontevedra, Spain",Spain,986 95 46 21,http://saludprogresa.com/,https://maps.google.com/?cid=4748991774706568343,"Progresa es el primer Centro Integral de Salud en Vigo, especializado en la salud uroginecológica, embarazo y pediatría. Ofrece una amplia gama de servicios que van desde fisioterapia y osteopatía general hasta tratamientos especializados en uroginecología y suelo pélvico. Su equipo multidisciplinar está compuesto por profesionales en fisioterapia, osteopatía, matrona, podología, nutrición y dietética, psicología y readaptación postural.

El público objetivo de Progresa son personas que buscan tratamientos integrales y especializados en áreas como la salud uroginecológica, el embarazo y la pediatría. Además, ofrece servicios de fisioterapia del desarrollo y osteopatía pediátrica para prevenir y tratar dificultades en bebés y niños. También cuenta con clases de pilates para embarazadas y otras actividades enfocadas en la salud y el bienestar.

Las ventajas competitivas de Progresa radican en su enfoque multidisciplinar, que permite ofrecer un tratamiento individualizado y específico a cada paciente. Además, su especialización en áreas como uroginecología, embarazo y pediatría le otorga un valor añadido al ser pionero en este tipo de","['#71264f', '#e0d7e2', '#fdfefe', '#bbb3bb', '#95818b']",https://business-finder-assets-2024.s3.amazonaws.com/logos/cropped-logo-2.png,https://business-finder-assets-2024.s3.amazonaws.com/screenshots/saludprogresa.com_.png
Nutricionista Gloria Lorenzo,"Rúa de María Berdiales, 25, bajo, Santiago de Vigo, 36203 Vigo, Pontevedra, Spain",Spain,687 14 52 32,https://www.searanutricionistavigo.com/,https://maps.google.com/?cid=11678067237076654564,"Seara Nutrición, dirigido por Gloria Lorenzo, se dedica a ofrecer asesoría nutricional personalizada y fomentar hábitos saludables en sus clientes. Con el objetivo de transformar el cuerpo de manera sostenible, la empresa se enfoca en la organización de la alimentación, la transformación de hábitos y la gestión del hambre emocional. Gloria Lorenzo, nutricionista y terapeuta ocupacional, se destaca por su enfoque integral que va más allá de lo médico, preocupándose por el bienestar emocional y las necesidades individuales de cada persona.

Los servicios principales de Seara Nutrición incluyen consultas personalizadas, talleres, programas online y recursos gratuitos para educar a sus clientes sobre nutrición y ayudarles a tomar las mejores decisiones para su salud. El público objetivo de la empresa son aquellas personas que desean abandonar el ciclo de las dietas y transformar su relación con la comida, buscando un cambio real y duradero en su estilo de vida. Las ventajas competitivas de Seara Nutrición radican en la experiencia y formación de Gloria Lorenzo, así como en su enfoque empático, motivador y personalizado que se aleja de las dietas restrictivas y busca el bienestar integral de sus clientes.

En resumen, Seara Nutric","['#c1bcb4', '#fefefe', '#393532', '#e87969', '#7b7d73']",https://business-finder-assets-2024.s3.amazonaws.com/logos/Logo-Meet_edited.png,https://business-finder-assets-2024.s3.amazonaws.com/screenshots/www.searanutricionistavigo.com_.png
