name,address,country,phone,website,google_maps_url,resumen,colores_hex,url_logo,url_screenshot
"Centro Suma: Fisioterapia, Nutrición y Psicología","Rúa de Joaquín Loriga, 13, Santiago de Vigo, 36203 Vigo, Pontevedra, Spain",Spain,650 56 96 06,http://www.sumavigo.com/,https://maps.google.com/?cid=8578099147801406913,"Centro SUMA es un centro de fisioterapia, psicología, entrenamiento personal y nutrición ubicado en Vigo. Ofrece una amplia gama de servicios que incluyen terapia individual, de pareja, familiar, entrenamiento individual y en pareja, fisioterapia respiratoria, ejercicios terapéuticos, punción seca, reeducación postural, entre otros. El público objetivo de Centro SUMA son personas que buscan mejorar su bienestar físico y emocional a través de servicios profesionales y personalizados.

Las ventajas competitivas de Centro SUMA radican en contar con un equipo de profesionales altamente cualificados y especializados en cada una de las áreas de servicio. Además, ofrecen un enfoque integral que combina la fisioterapia, la psicología, el entrenamiento personal y la nutrición para brindar un tratamiento completo a sus clientes. Su ubicación estratégica en Vigo les permite atender a una amplia clientela en la zona.

En resumen, Centro SUMA es un centro especializado en fisioterapia, psicología, entrenamiento personal y nutrición en Vigo, que ofrece servicios profesionales y personalizados para mejorar el bienestar físico y emocional de sus clientes. Con un equipo de profesionales altamente cualificados y una ubicación estratégica, Centro SUMA se destaca","['#fefefe', '#5a97ae', '#396d91', '#6da8c1', '#e5e6e7']",https://business-finder-assets-2024.s3.amazonaws.com/logos/logo-suma-web.png,https://business-finder-assets-2024.s3.amazonaws.com/screenshots/www.sumavigo.com_.png
Consulta Doctora Carmen Bravo,"Rúa Pintor Laxeiro, 28, Freixeiro, 36211 Vigo, Pontevedra, Spain",Spain,986 21 20 29,http://www.doctoracarmenbravo.com/,https://maps.google.com/?cid=315719998609353660,"La Dra. Carmen Bravo es una nutricionista y médica que ofrece servicios de consulta en Vigo. Con más de 25 años de experiencia, se especializa en nutrición, psiconeuroinmunología, medicina natural y estilo de vida. Su enfoque se centra en brindar tratamientos personalizados para mejorar la salud integral de sus pacientes, ya sea para tratar síntomas específicos o para promover un estilo de vida saludable de forma preventiva.

Entre los principales servicios que ofrece la Dra. Carmen Bravo se encuentran la exploración clínica completa, pruebas complementarias como análisis de sangre y test de intolerancias alimentarias, educación alimentaria, cambios en hábitos nutricionales, apoyo psicológico, tratamientos para patologías como obesidad, diabetes, hipertensión y dislipemias, y tratamientos personalizados que incluyen medicina convencional, ortomolecular, flores de Bach y dietas de aporte proteico. Su objetivo es mejorar la salud física y psicológica de sus pacientes, brindando cercanía y confianza en cada visita.

El público objetivo de la Dra. Carmen Bravo son personas que buscan mejorar su salud a través de la nutrición y la medicina natural, ya sea para tratar problemas de salud específicos o para adoptar un estilo de vida más salud","['#fcfcfb', '#a4bdcb', '#336b7f', '#d9e1e7', '#c5aa9c']",,https://business-finder-assets-2024.s3.amazonaws.com/screenshots/www.doctoracarmenbravo.com_.png
