name,address,country,phone,website,google_maps_url,resumen,colores_hex,url_logo,url_screenshot
Qaroní (A Coruña),"Rúa Emilio González López, 51, bajo, 15011 A Coruña, Spain",Spain,881 02 59 24,https://qaroni.com/,https://maps.google.com/?cid=3303373921451861088,"Qaroní es una empresa de desarrollo de software que se enfoca en transformar los retos tecnológicos en soluciones innovadoras para sus clientes. Ofrecen una variedad de servicios y productos, como consultoría estratégica, desarrollo de software a medida, diseño UX/UI, entre otros. Su objetivo es crear software seguro, escalable y centrado en la experiencia del usuario, adaptado a las necesidades de cada cliente.

Entre los productos principales de Qaroní se encuentran Workards, un software de recursos humanos; PLAAM, un software ERP & CRM multisector; Rutas de Tapeo, una plataforma para concursos gastronómicos; y QPay360, una solución cashless para eventos. Su público objetivo abarca sectores como banca y servicios financieros, administración pública, logística y transporte, tercer sector, industria y retail, y e-commerce. Sus soluciones se adaptan a las necesidades de cada sector, ofreciendo soluciones especializadas y tecnológicas.

Qaroní destaca por su experiencia en el desarrollo de software y la innovación de soluciones para diversos sectores, así como por su enfoque en la experiencia del usuario y la seguridad de sus productos. Su capacidad para adaptarse a las necesidades de cada cliente, ofreciendo soluciones a medida y escalables, les otorga una ventaja competitiva en el mercado de desarrollo de software.","['#b3b6b9', '#f9fafd', '#032a42', '#fab658', '#478997']",https://business-finder-assets-2024.s3.amazonaws.com/logos/qaroni-logo-black.webp,https://business-finder-assets-2024.s3.amazonaws.com/screenshots/qaroni.com_.png
Docuten Tech,"HI Coruña, Av. Porto da Coruña, 3, Planta Baja. Local 6, 15003 A Coruña, La Coruña, Spain",Spain,981 26 96 85,http://www.docuten.com/,https://maps.google.com/?cid=6618645764236301975,"Docuten es una empresa que se dedica a la digitalización de procesos administrativos, ofreciendo servicios como firma digital, factura electrónica, carta de porte digital, soluciones Agrotech, entre otros. Su propuesta de valor radica en ser un único proveedor para la digitalización completa de los procesos de firma y facturación, brindando garantías legales y agilizando la gestión de documentación laboral, mercantil y comercial. Su público objetivo abarca diversos sectores como alimentación, recursos humanos, construcción, fashion retail, entre otros.

La empresa se destaca por ofrecer una plataforma intuitiva y fácil de usar, sin necesidad de descargar una app, con acceso desde cualquier dispositivo con conexión a Internet. Además, Docuten cuenta con personalización en la atención al cliente, brindando formaciones, asistencia técnica y atención personalizada durante todo el proceso. Su seguridad está respaldada por certificaciones internacionales como ISO 27001, garantizando la protección de la información de sus clientes. En cuanto a ventajas competitivas, Docuten se posiciona como un Prestador Cualificado de Servicios de Confianza (PCSC) y se encuentra en la Lista de Proveedores Certificados de Peppol, lo que le permite cumplir con las normativas vigentes y futuras en materia de facturación electrónica.","['#2c76f6', '#fafafb', '#9fb8e1', '#494a4b', '#2f5dec']",https://business-finder-assets-2024.s3.amazonaws.com/logos/logo_positivo.svg,https://business-finder-assets-2024.s3.amazonaws.com/screenshots/www.docuten.com_.png
Plexus Tech (A Coruña),"Rúa Galileo Galilei, nº 2- 1º, 15008 A Coruña, Spain",Spain,902 99 80 05,https://www.plexus.es/,https://maps.google.com/?cid=13708329479081154242,"Plexus Tech es una empresa de consultoría, servicios y soluciones IT con una amplia trayectoria en el sector tecnológico. Ofrece servicios tecnológicos y soluciones integrales desarrolladas a medida para organismos públicos, compañías del IBEX 35, grandes retailers, operadores turísticos y entidades financieras. Además, cuenta con productos propios innovadores centrados en mejorar la vida de personas y compañías en todos los sectores.

Entre los servicios principales de Plexus Tech se encuentran un ecosistema de servicios tecnológicos 360º basados en innovación y desarrollo, así como soluciones tecnológicas propias para todos los sectores. Su público objetivo son empresas y entidades que buscan soluciones tecnológicas personalizadas y productos innovadores para mejorar su funcionamiento y crecimiento. Plexus Tech se destaca por su enfoque en la innovación, el desarrollo de productos propios y su capacidad para adaptarse a las necesidades específicas de cada cliente.

Las ventajas competitivas de Plexus Tech radican en su amplia experiencia en el sector, su equipo de profesionales altamente cualificados y su capacidad para desarrollar soluciones tecnológicas a medida. Además, su enfoque en la innovación y el desarrollo de productos propios le permite ofrecer a sus clientes soluciones únicas y adaptadas a las últimas tendencias tecnológicas","['#fefefe', '#023c55', '#94acb6', '#447083', '#d8dbdd']",https://business-finder-assets-2024.s3.amazonaws.com/logos/LOGO-PLEXUS-2020_WHITE.png,https://business-finder-assets-2024.s3.amazonaws.com/screenshots/www.plexus.es_.png
