name,address,country,phone,website,google_maps_url,resumen,colores_hex,url_logo,url_screenshot
"SISTEC Tecnología y Sistemas, S.L.","Arbidea Kalea, 14, Otxarkoaga - Txurdinaga, 48004 Bilbao, Bizkaia, Spain",Spain,943 21 50 16,http://www.sistects.es/,https://maps.google.com/?cid=8971815213052002961,"Sistec es una empresa especializada en soluciones y servicios de SAP Business One, el ERP líder en el mercado que se adapta a las necesidades específicas de las pequeñas y medianas empresas. Ofrecen una amplia gama de soluciones tecnológicas innovadoras, confiables y orientadas a impulsar el éxito de los negocios, como MARIProject, SisTax, SisSGA y SisRes, entre otros.

Su público objetivo son las pequeñas y medianas empresas que buscan mejorar su gestión empresarial y optimizar sus procesos a través de la innovación tecnológica. Sistec se destaca por su experiencia de más de 30 años en el sector, así como por su compromiso con la cercanía, el servicio, la transparencia y la innovación. Además, ofrecen servicios de consultoría, formación, soporte y alojamiento en la nube para garantizar el éxito de sus clientes.

Las ventajas competitivas de Sistec radican en su enfoque en la adaptación de soluciones tecnológicas a las necesidades específicas de cada empresa, su amplia gama de servicios complementarios y su compromiso con la innovación y la eficiencia empresarial. Con un equipo de profesionales expertos en SAP Business One, Sistec se posiciona como un socio estratégico para el crecimiento y desarrollo","['#e2dfe7', '#321356', '#d79140', '#faf8f4', '#827899']",https://business-finder-assets-2024.s3.amazonaws.com/logos/logo-sistec-ts.svg,https://business-finder-assets-2024.s3.amazonaws.com/screenshots/www.sistects.es_.png
NTS Seidor,"Carr. Bilbao-Galdakao, 6A, 1ºLK, 48004 Bilbao, Vizcaya, Spain",Spain,944 76 28 77,http://www.nts-solutions.com/,https://maps.google.com/?cid=17938096914885217009,"SEIDOR es una firma de consultoría tecnológica con más de 10,000 profesionales que ha experimentado un crecimiento del 28% en sus ingresos, alcanzando los €1,125 millones en 2024. La empresa espera mantener un crecimiento de dos dígitos en 2025 y duplicar su cifra de negocios en un horizonte de cinco años. SEIDOR ha recibido premios como el SAP Pinnacle Award 2025 por su impulso global en las PYMEs y el SAP Quality Award 2024 por su proyecto con CMCC Foundation. Además, la empresa ha expandido su infraestructura en la nube en Estados Unidos con la inauguración de dos nuevos centros de datos.

Los principales servicios de SEIDOR incluyen consultoría tecnológica, implementación de soluciones SAP, y fortalecimiento de la infraestructura en la nube. Su público objetivo son empresas y organizaciones que buscan mejorar su eficiencia operativa, implementar soluciones tecnológicas avanzadas y optimizar su gestión de datos. SEIDOR se destaca por su enfoque en la innovación, la calidad de sus proyectos y su capacidad para adaptarse a las necesidades cambiantes del mercado.

Las ventajas competitivas de SEIDOR radican en su amplia experiencia en consultoría tecnológica, su reconocimiento","['#fdfdfd', '#000000', '#3a4666', '#0c74e0', '#b2bacd']",,https://business-finder-assets-2024.s3.amazonaws.com/screenshots/www.nts-solutions.com_.png
zabalIT,"San Vicente Kalea, 1d, 48902 Barakaldo, Bizkaia, Spain",Spain,946 07 64 66,http://zabalit.com/,https://maps.google.com/?cid=7800254022351857846,"Zabalit es una empresa dedicada a la consultoría IT, diseño y desarrollo de software, ofreciendo soluciones a medida para cada problema. Sus principales servicios incluyen consultoría, arquitectura de software y desarrollo de software a medida, trabajando con una metodología ágil como SCRUM para garantizar entregas parciales y regulares del producto final.

El público objetivo de Zabalit son empresas que buscan soluciones tecnológicas personalizadas y de calidad. Sus ventajas competitivas se centran en la experiencia y profesionalismo de su equipo, así como en la capacidad de ofrecer soluciones a medida que se adaptan a las necesidades específicas de cada cliente. Además, su enfoque en la metodología SCRUM les permite garantizar la entrega oportuna y eficiente de los proyectos.

Con casos de éxito como el sistema de movilidad de donantes, Zabalit ha demostrado su capacidad para trabajar con clientes de diversos sectores como BBK, Bioef, EJIE, IMQ, Kroni, Siemens Gamesa, Osakidetza y Athletic Club, lo que respalda su reputación en el mercado. Además, su compromiso con las energías renovables, siendo socios de Goiener, muestra su interés en temas actuales y sostenibles.","['#7c900f', '#f2f5f4', '#bbcf02', '#abc4be', '#505042']",https://business-finder-assets-2024.s3.amazonaws.com/logos/logo-zabalit-nuevo.png,https://business-finder-assets-2024.s3.amazonaws.com/screenshots/zabalit.com_.png
